[{"confidence":{"authority":"validated-machine","completeness":"sufficient","conflict_status":"none","derivation_method":"deterministic","evidence_strength":"corroborated","level":"high"},"direction":"outbound","edge_id":"edge:0ab54ce4140474447958e85527229cb29558bb0687ec79a5b5f8965efd56440e","edge_type":"CONTAINS","evidence_refs":["evidence:77ea38aad92ee15e35e79e63a72d6bf1578f61a214f76d96efe25ccbcbd4412c"],"properties":{},"source_id":"repo:l9-gate-sdk","target_id":"artifact:f7ede513d2b6b1728a049f3d5dfb16b8194a6c17f3fb71081af46f418542a4c0"},{"confidence":{"authority":"validated-machine","completeness":"sufficient","conflict_status":"none","derivation_method":"deterministic","evidence_strength":"corroborated","level":"high"},"direction":"outbound","edge_id":"edge:1cc5bdff282cbceb1e14c37f3cc16e5239aae23c41eb61d70bd9c9b67439e357","edge_type":"DOCUMENTED_BY","evidence_refs":["evidence:9745cf9f5aa2a55d0d0ec956f595a9102051224f6da654c5e756128b06ba6c50"],"properties":{},"source_id":"repo:l9-gate-sdk","target_id":"artifact:5f126e3f65e9973b75f256931c8f56ef5c10fce96dc6be43eee0442b7d3eaf71"},{"confidence":{"authority":"validated-machine","completeness":"sufficient","conflict_status":"none","derivation_method":"deterministic","evidence_strength":"corroborated","level":"high"},"direction":"outbound","edge_id":"edge:227bb8487f0814ef42e328f36f25a2a9aa12684c2e0ab40e24839026abeefa74","edge_type":"VALIDATED_BY","evidence_refs":["evidence:69a738878ad517887bb645a85d8020726f36ac3d8c9b988befd492ab82c9f402"],"properties":{},"source_id":"repo:l9-mcp-server","target_id":"artifact:2dce6ccb144fcee4e7086e61cf238dbc76585c50ea2bc647a75724c85385eede"},{"confidence":{"authority":"validated-machine","completeness":"sufficient","conflict_status":"none","derivation_method":"deterministic","evidence_strength":"corroborated","level":"high"},"direction":"outbound","edge_id":"edge:3c7bab0550a422f17a8d067aaf79ad8c80ef015203f185800a57b4c581cd2448","edge_type":"OWNED_BY","evidence_refs":["evidence:08ca8f0cd96a01443445b6387276901fbaf327dffc2300a6db16a341bf1959ef","evidence:2b5e0a5f4722f1f0912ed76f4154d926770011124bcbddbc892f04c67c9d4b15","evidence:557d52b82c0b9cf39a92ad68dc6f894ce490cfced8974cea75adcd3eea642d8e","evidence:77ea38aad92ee15e35e79e63a72d6bf1578f61a214f76d96efe25ccbcbd4412c","evidence:9745cf9f5aa2a55d0d0ec956f595a9102051224f6da654c5e756128b06ba6c50","evidence:ad85781ad2fab7fd28d63dd6e14ddbc6fa1d3b54ce1978223c93bc704ae485e5","evidence:d2338cd112c2b2367b1e129321fa71b7ea910795b0328749b40ebc0e454cd0e6"],"properties":{},"source_id":"repo:l9-gate-sdk","target_id":"owner:igor_beylin"},{"confidence":{"authority":"validated-machine","completeness":"sufficient","conflict_status":"none","derivation_method":"deterministic","evidence_strength":"corroborated","level":"high"},"direction":"outbound","edge_id":"edge:5c667c6a5adffd07fcbadeff1bd3109fc1d4dd769ddceafff31a5b566de5f8d4","edge_type":"IMPLEMENTS","evidence_refs":["evidence:053ade54eab180cfb6442885f9b719e70855791f3ca2005aaf8172f26077af5a","evidence:69a738878ad517887bb645a85d8020726f36ac3d8c9b988befd492ab82c9f402","evidence:8f4331cf9239c6121cb63ea3568998cdf31f0cf1cc1beef54201ac03d6ebd525","evidence:944d594375fc539e595d57462092de4c3af2837ec28ab2be4712373efd08be46","evidence:c87556ab9f0ac784f89a55b400f8a6c61be905b44e23f5d40e47aaa6c4a376a5"],"properties":{},"source_id":"repo:l9-mcp-server","target_id":"capability:l9-mcp-server:service"},{"confidence":{"authority":"validated-machine","completeness":"sufficient","conflict_status":"none","derivation_method":"deterministic","evidence_strength":"corroborated","level":"high"},"direction":"outbound","edge_id":"edge:5e6ee5aac02353cc52a521458815e12a7f7411fe4eaf7dad0ed1b9d5780ee9e4","edge_type":"IMPLEMENTS","evidence_refs":["evidence:053ade54eab180cfb6442885f9b719e70855791f3ca2005aaf8172f26077af5a","evidence:69a738878ad517887bb645a85d8020726f36ac3d8c9b988befd492ab82c9f402","evidence:8f4331cf9239c6121cb63ea3568998cdf31f0cf1cc1beef54201ac03d6ebd525","evidence:944d594375fc539e595d57462092de4c3af2837ec28ab2be4712373efd08be46","evidence:c87556ab9f0ac784f89a55b400f8a6c61be905b44e23f5d40e47aaa6c4a376a5"],"properties":{},"source_id":"repo:l9-mcp-server","target_id":"capability:l9-mcp-server:topology"},{"confidence":{"authority":"validated-machine","completeness":"sufficient","conflict_status":"none","derivation_method":"deterministic","evidence_strength":"corroborated","level":"high"},"direction":"outbound","edge_id":"edge:6700150709a4d6aae2a9d6d95fa3cdad01409acfcbe16843b3fc63a6858da2ad","edge_type":"DOCUMENTED_BY","evidence_refs":["evidence:944d594375fc539e595d57462092de4c3af2837ec28ab2be4712373efd08be46"],"properties":{},"source_id":"repo:l9-mcp-server","target_id":"artifact:9c1767f9bb12ecc3e5fb0fe32b10a967ecadd3960c4ebb25e402edab71fbe95e"},{"confidence":{"authority":"validated-machine","completeness":"sufficient","conflict_status":"none","derivation_method":"deterministic","evidence_strength":"corroborated","level":"high"},"direction":"outbound","edge_id":"edge:742f3f52e137823c58b0a63a61ac412fdaeeda38de92e289618bd1794a015a42","edge_type":"CONTAINS","evidence_refs":["evidence:2b5e0a5f4722f1f0912ed76f4154d926770011124bcbddbc892f04c67c9d4b15"],"properties":{},"source_id":"repo:l9-gate-sdk","target_id":"artifact:d975b17685aec233a012ffd6a4d9f59013dd15d5e8723a70446ee95a40822a5a"},{"confidence":{"authority":"validated-machine","completeness":"sufficient","conflict_status":"none","derivation_method":"deterministic","evidence_strength":"corroborated","level":"high"},"direction":"outbound","edge_id":"edge:745dc14ad3a08071dd46aafe689684ea55174edada32085426165ef8bcc4ffa8","edge_type":"IMPLEMENTS","evidence_refs":["evidence:08ca8f0cd96a01443445b6387276901fbaf327dffc2300a6db16a341bf1959ef","evidence:2b5e0a5f4722f1f0912ed76f4154d926770011124bcbddbc892f04c67c9d4b15","evidence:557d52b82c0b9cf39a92ad68dc6f894ce490cfced8974cea75adcd3eea642d8e","evidence:77ea38aad92ee15e35e79e63a72d6bf1578f61a214f76d96efe25ccbcbd4412c","evidence:9745cf9f5aa2a55d0d0ec956f595a9102051224f6da654c5e756128b06ba6c50"],"properties":{},"source_id":"repo:l9-gate-sdk","target_id":"capability:l9-gate-sdk:library"},{"confidence":{"authority":"validated-machine","completeness":"sufficient","conflict_status":"none","derivation_method":"deterministic","evidence_strength":"corroborated","level":"high"},"direction":"outbound","edge_id":"edge:7b9e8040a00002399d85dfd80160f38002e2af7e6b566b244a4995664fbfeefc","edge_type":"CONTAINS","evidence_refs":["evidence:08ca8f0cd96a01443445b6387276901fbaf327dffc2300a6db16a341bf1959ef","evidence:557d52b82c0b9cf39a92ad68dc6f894ce490cfced8974cea75adcd3eea642d8e","evidence:ad85781ad2fab7fd28d63dd6e14ddbc6fa1d3b54ce1978223c93bc704ae485e5"],"properties":{},"source_id":"repo:l9-gate-sdk","target_id":"artifact:af3d308e231a7968eea3d46457851b19a65324e505028f3f905659b54e859ecc"},{"confidence":{"authority":"validated-machine","completeness":"sufficient","conflict_status":"none","derivation_method":"deterministic","evidence_strength":"corroborated","level":"high"},"direction":"outbound","edge_id":"edge:96e1409d106e7ba77bf2f0eeddc895efea44eb5bad3cdc200670651299482c63","edge_type":"GOVERNED_BY","evidence_refs":["evidence:d2338cd112c2b2367b1e129321fa71b7ea910795b0328749b40ebc0e454cd0e6"],"properties":{},"source_id":"repo:l9-gate-sdk","target_id":"artifact:fe5b06075d3778c6952dc2966f2d90c521e9866bdec32b075d42c4efaca36838"},{"confidence":{"authority":"validated-machine","completeness":"sufficient","conflict_status":"none","derivation_method":"deterministic","evidence_strength":"corroborated","level":"high"},"direction":"outbound","edge_id":"edge:a9921daebc9f82bbb88dcdfe75e6128843e9c4574b29771d40e28c20d0947b7e","edge_type":"VALIDATED_BY","evidence_refs":["evidence:2b5e0a5f4722f1f0912ed76f4154d926770011124bcbddbc892f04c67c9d4b15"],"properties":{},"source_id":"repo:l9-gate-sdk","target_id":"artifact:d975b17685aec233a012ffd6a4d9f59013dd15d5e8723a70446ee95a40822a5a"},{"confidence":{"authority":"validated-machine","completeness":"sufficient","conflict_status":"none","derivation_method":"deterministic","evidence_strength":"corroborated","level":"high"},"direction":"outbound","edge_id":"edge:bcb26b22bfd5c72032c9bc9522aef656467b45223ad1c41a0cc231c57723c192","edge_type":"CONTAINS","evidence_refs":["evidence:9745cf9f5aa2a55d0d0ec956f595a9102051224f6da654c5e756128b06ba6c50"],"properties":{},"source_id":"repo:l9-gate-sdk","target_id":"artifact:5f126e3f65e9973b75f256931c8f56ef5c10fce96dc6be43eee0442b7d3eaf71"},{"confidence":{"authority":"validated-machine","completeness":"sufficient","conflict_status":"none","derivation_method":"deterministic","evidence_strength":"corroborated","level":"high"},"direction":"outbound","edge_id":"edge:ccf26f542d4bf0f8a77a17720f8d46cfd9066467d694fd8d1b0960320e63680d","edge_type":"CONTAINS","evidence_refs":["evidence:d2338cd112c2b2367b1e129321fa71b7ea910795b0328749b40ebc0e454cd0e6"],"properties":{},"source_id":"repo:l9-gate-sdk","target_id":"artifact:fe5b06075d3778c6952dc2966f2d90c521e9866bdec32b075d42c4efaca36838"},{"confidence":{"authority":"validated-machine","completeness":"sufficient","conflict_status":"none","derivation_method":"deterministic","evidence_strength":"corroborated","level":"high"},"direction":"outbound","edge_id":"edge:d2fe7806cdc7816e308fa135cda0c7c88eeb47cf21ba9eb8808c7a5e7f62c230","edge_type":"GOVERNED_BY","evidence_refs":["evidence:77ea38aad92ee15e35e79e63a72d6bf1578f61a214f76d96efe25ccbcbd4412c"],"properties":{},"source_id":"repo:l9-gate-sdk","target_id":"artifact:f7ede513d2b6b1728a049f3d5dfb16b8194a6c17f3fb71081af46f418542a4c0"},{"confidence":{"authority":"validated-machine","completeness":"sufficient","conflict_status":"none","derivation_method":"deterministic","evidence_strength":"corroborated","level":"high"},"direction":"outbound","edge_id":"edge:d85fdf456c96b1361a0068c3660e5a4ec23fc598a844c28f32e4b1b679d169fb","edge_type":"CONTAINS","evidence_refs":["evidence:944d594375fc539e595d57462092de4c3af2837ec28ab2be4712373efd08be46"],"properties":{},"source_id":"repo:l9-